Mã sản phẩm,Tên sản phẩm,Giá,Doanh thu,Tên cửa hàng,Tỉ lệ hoa hồng,Hoa hồng,Link sản phẩm,Link ưu đãi
56802370192,"Ghế an toàn cho trẻ sơ sinh từ 9 tháng đến 12 tuổi, Ghế an toàn cho trẻ em, ghế an toàn có Isofix, ghế trẻ em","1,2tr",0,odhi0z0dpp,4%,₫48.389,https://shopee.vn/product/1686630123/56802370192,https://s.shopee.vn/902xMc2jCX
40402965053,"Ghế an toàn cho trẻ em trên ô tô, ghế an toàn cho trẻ sơ sinh, ghế ngồi và ngả lưng, ghế an toàn cho trẻ em gắn trên ô","3,1tr",0,8rbp0bhxfc,4%,₫125.137,https://shopee.vn/product/1495929633/40402965053,https://s.shopee.vn/8pjXAJ3MXW
41131575770,"Ghế an toàn cho bé 3-9 tuổi, Ghế ô tô có thể tháo giặt,Ghế an toàn ô tô cho trẻ có ISOFIX , Ghế an toàn cho trẻ em","1,3tr",0,phuongthuyqw49,4%,₫52.491,https://shopee.vn/product/716597360/41131575770,https://s.shopee.vn/8fQ6y03zsV
57761924270,"Ghế an toan ô tô cho trẻ em,Ghế an toàn cho trẻ em, ghế an toàn có Isofix, ghế cho trẻ sơ sinh từ 9 tháng đến 12 tuổi","1,1tr",0,1wimujpvb1,8%,₫87.100,https://shopee.vn/product/1502053646/57761924270,https://s.shopee.vn/7AbJBF9hvE
27941691676,Ghế trẻ em trên ô tô Ghế an toàn cho trẻ em Xe ô tô Ghế an toàn cho trẻ em Dây an toàn có thể điều chỉnh,"331,5k",6,yunzhenshipin.vn,14%,₫46.414,https://shopee.vn/product/1623712862/27941691676,https://s.shopee.vn/70HsywALGD
46801660136,"Ghế an toàn cho trẻ em, ghế an toàn có Isofix, ghế trẻ em, ghế cho trẻ sơ sinh từ 9 tháng đến 12 tuổi","1,3tr",100,aojv99dh1r,6%,₫80.879,https://shopee.vn/product/1660587625/46801660136,https://s.shopee.vn/6pySmdAybC
43579285568,"Ghế an toàn cho trẻ em trên ô tô, ghế an toàn cho trẻ sơ sinh, có thể điều chỉnh để nằm và ngồi, ghế an toàn đa năng cho","1,9tr",0,Mama & Baby Store,4%,₫77.301,https://shopee.vn/product/1728841476/43579285568,https://s.shopee.vn/6ff2aKBbwB
50151717087,"SUTONGXUE Ghế ngồi ô tô trẻ em, Phụ kiện xe đẩy Ghế lót Ghế an toàn cho trẻ em Đệm ngồi an toàn, Đệm Pram có thể giặt được Thảm ghế đẩy màu trơn Nệm ô tô đa năng Xe đẩy ghế cao","210,6k",4,SUTONGXUE,4%,₫8.424,https://shopee.vn/product/690717592/50151717087,https://s.shopee.vn/7pqzyT7AZQ
49750725680,"AnakkuG401Ghế an toàn cho trẻ em, ghế an toàn cho trẻ em, xuất khẩu ghế an toàn cho trẻ em","2,5tr",0,Phụ kiện ô tô chuyên nghiệp,4%,₫100.807,https://shopee.vn/product/1529402218/49750725680,https://s.shopee.vn/7fXZmA7nuP
52209492564,"Ghế an toàn cho trẻ em có thể dùng để ngồi hoặc ngả lưng, ghế an toàn cho trẻ em gắn trên ô tô, ghế an toàn ô tô.","5,8tr",3,Ưu chọn bé xinh,4%,₫231.713,https://shopee.vn/product/1784209884/52209492564,https://s.shopee.vn/7VE9Zr8RFO
51361950320,"Ghế An Toàn Có Isofix,Ghế An Toàn Cho Trẻ Em Ulebo Gấp, Đệm Tăng Chiều Cao, Ghế An Toàn Di Động Cho Trẻ Em Trên Ô Tô","1,5tr",0,1wimujpvb1,8%,₫119.830,https://shopee.vn/product/1502053646/51361950320,https://s.shopee.vn/7KujNY94aN
55662144305,"Ghế an toàn gấp gọn di động cho trẻ em, ghế ô tô đa năng, Ghế an toàn ISOFIX. Ghế an toàn cho bé 9 tháng- 12 tuổi ","1,6tr",0,1wimujpvb1,8%,₫128.286,https://shopee.vn/product/1502053646/55662144305,https://s.shopee.vn/5q5vanEmd6
28437554214,Đệm ghế an toàn cho trẻ ô tô Thảm làm mát cho trẻ em trên ô tô Thảm xe đẩy trẻ em ghế an toàn mùa hè cho trẻ em Chiếu điều hoà Đệm thoáng khí Bassinet Tấm làm mát Sản phẩm du lịch cho bé,"1,4tr",12,SIXTH Cửa hàng cung cấp ô tô,7%,₫95.189,https://shopee.vn/product/904877201/28437554214,https://s.shopee.vn/5fmVOUFPy5
52461928847,"Ghế an toan ô tô cho bé có thể gấp gọn , Ghế an toàn cho trẻ bé 9 tháng đến 12 tuổi, Ghế an toàn cho trẻ em Genius Baby,","842,4k",0,phuongthuyqw49,4%,₫33.696,https://shopee.vn/product/716597360/52461928847,https://s.shopee.vn/5VT5CBG3J4
40502960527,"Ghế an toàn cho trẻ em, ghế an toàn gập lại, ghế an toàn di động đa năng","2,9tr",0,8rbp0bhxfc,4%,₫115.567,https://shopee.vn/product/1495929633/40502960527,https://s.shopee.vn/5L9ezsGge3
46657266456,"Ghế ngồi ô tô an toàn cho trẻ em Kangaroo Daddy, đảm bảo an toàn và tiện lợi khi di chuyển, ghế an toàn cho trẻ sơ sinh.","2,2tr",0,Mama & Baby Store,4%,₫89.029,https://shopee.vn/product/1728841476/46657266456,https://s.shopee.vn/6VLcO1CFHI
57902599008,Ghế an toàn trẻ em trên xe ô tô/ Ghế tựa an toàn trẻ em ô tô/ Ghế ô tô trẻ em,"1,2tr",1,Pichu,4%,₫47.560,https://shopee.vn/product/119978286/57902599008,https://s.shopee.vn/6L2CBiCscH
